{
  "protocol_version": 1,
  "job_id": "fill-contact-request-example",
  "operation_id": "consulting",
  "brand_id": "henko",
  "document_type": "pdf-form-fill",
  "artifact_dir": "./artifacts",
  "input": {
    "organization_root": "./examples/organization-docs",
    "document": {
      "template_path": "forms/contact-request.pdf",
      "field_values": {"full_name": "Ada Lovelace", "consent": true, "contact_method": "email", "country": "CO"},
      "flatten": false
    },
    "context": {
      "organization": {"name": "Henko Technologies"},
      "operation": {"name": "Consulting"},
      "brand": {"id": "henko", "name": "Henko Technologies", "version": "1.0.0"},
      "document_type": {"id": "pdf-form-fill", "version": "1.0.0"}
    }
  }
}
